{
  "schema_version": "1.0",
  "run_id": "smoke-20260723t190000000z-a1b2c3d4e5f6",
  "created_utc": "2026-07-23T19:00:00.0000000+00:00",
  "completed_utc": "2026-07-23T19:00:15.0000000+00:00",
  "final_state": "completed",
  "exit_reason": "completed",
  "components": [
    {
      "component_id": "server",
      "process_id": 4200,
      "exit_code": 0
    },
    {
      "component_id": "spectator-wide",
      "process_id": 4201,
      "stable_window_title": "Arena - Wide [smoke-20260723t190000000z-a1b2c3d4e5f6]",
      "exit_code": 0
    }
  ],
  "artifacts": [
    {
      "path": "lifecycle.ndjson",
      "sha256": "a3c9e0c1c78e8797c0b2b1653318f45edb7c8738984cac591f504b4b0c5faa02",
      "bytes": 720
    },
    {
      "path": "final-save.sav",
      "sha256": "c87f90a1f4d723b3fb8cae06db85a0ae8fce9df8735f1b4a5c1d65a75f4a36c9",
      "bytes": 1024
    }
  ]
}
